cord_uid,title,abstract
ug7v899j,"Clinical features of culture-proven Mycoplasma pneumoniae infections at King Abdulaziz University Hospital, Jeddah, Saudi Arabia","OBJECTIVE: This retrospective chart review describes the epidemiology and clinical features of 40 patients with culture-proven Mycoplasma pneumoniae infections at King Abdulaziz University Hospital, Jeddah, Saudi Arabia. METHODS: Patients with positive M. pneumoniae cultures from respiratory specimens from January 1997 through December 1998 were identified through the Microbiology records. Charts of patients were reviewed. RESULTS: 40 patients were identified, 33 (82.5%) of whom required admission. Most infections (92.5%) were community-acquired. The infection affected all age groups but was most common in infants (32.5%) and pre-school children (22.5%). It occurred year-round but was most common in the fall (35%) and spring (30%). More than three-quarters of patients (77.5%) had comorbidities. Twenty-four isolates (60%) were associated with pneumonia, 14 (35%) with upper respiratory tract infections, and 2 (5%) with bronchiolitis. Cough (82.5%), fever (75%), and malaise (58.8%) were the most common symptoms, and crepitations (60%), and wheezes (40%) were the most common signs. Most patients with pneumonia had crepitations (79.2%) but only 25% had bronchial breathing. Immunocompromised patients were more likely than non-immunocompromised patients to present with pneumonia (8/9 versus 16/31, P = 0.05). Of the 24 patients with pneumonia, 14 (58.3%) had uneventful recovery, 4 (16.7%) recovered following some complications, 3 (12.5%) died because of M pneumoniae infection, and 3 (12.5%) died due to underlying comorbidities. The 3 patients who died of M pneumoniae pneumonia had other comorbidities. CONCLUSION: our results were similar to published data except for the finding that infections were more common in infants and preschool children and that the mortality rate of pneumonia in patients with comorbidities was high."
02tnwd4m,Nitric oxide: a pro-inflammatory mediator in lung disease?,"Inflammatory diseases of the respiratory tract are commonly associated with elevated production of nitric oxide (NO•) and increased indices of NO• -dependent oxidative stress. Although NO• is known to have anti-microbial, anti-inflammatory and anti-oxidant properties, various lines of evidence support the contribution of NO• to lung injury in several disease models. On the basis of biochemical evidence, it is often presumed that such NO• -dependent oxidations are due to the formation of the oxidant peroxynitrite, although alternative mechanisms involving the phagocyte-derived heme proteins myeloperoxidase and eosinophil peroxidase might be operative during conditions of inflammation. Because of the overwhelming literature on NO• generation and activities in the respiratory tract, it would be beyond the scope of this commentary to review this area comprehensively. Instead, it focuses on recent evidence and concepts of the presumed contribution of NO• to inflammatory diseases of the lung."
ejv2xln0,Surfactant protein-D and pulmonary host defense,"Surfactant protein-D (SP-D) participates in the innate response to inhaled microorganisms and organic antigens, and contributes to immune and inflammatory regulation within the lung. SP-D is synthesized and secreted by alveolar and bronchiolar epithelial cells, but is also expressed by epithelial cells lining various exocrine ducts and the mucosa of the gastrointestinal and genitourinary tracts. SP-D, a collagenous calcium-dependent lectin (or collectin), binds to surface glycoconjugates expressed by a wide variety of microorganisms, and to oligosaccharides associated with the surface of various complex organic antigens. SP-D also specifically interacts with glycoconjugates and other molecules expressed on the surface of macrophages, neutrophils, and lymphocytes. In addition, SP-D binds to specific surfactant-associated lipids and can influence the organization of lipid mixtures containing phosphatidylinositol in vitro. Consistent with these diverse in vitro activities is the observation that SP-D-deficient transgenic mice show abnormal accumulations of surfactant lipids, and respond abnormally to challenge with respiratory viruses and bacterial lipopolysaccharides. The phenotype of macrophages isolated from the lungs of SP-D-deficient mice is altered, and there is circumstantial evidence that abnormal oxidant metabolism and/or increased metalloproteinase expression contributes to the development of emphysema. The expression of SP-D is increased in response to many forms of lung injury, and deficient accumulation of appropriately oligomerized SP-D might contribute to the pathogenesis of a variety of human lung diseases."
2b73a28n,Role of endothelin-1 in lung disease,"Endothelin-1 (ET-1) is a 21 amino acid peptide with diverse biological activity that has been implicated in numerous diseases. ET-1 is a potent mitogen regulator of smooth muscle tone, and inflammatory mediator that may play a key role in diseases of the airways, pulmonary circulation, and inflammatory lung diseases, both acute and chronic. This review will focus on the biology of ET-1 and its role in lung disease."
9785vg6d,Gene expression in epithelial cells in response to pneumovirus infection,"Respiratory syncytial virus (RSV) and pneumonia virus of mice (PVM) are viruses of the family Paramyxoviridae, subfamily pneumovirus, which cause clinically important respiratory infections in humans and rodents, respectively. The respiratory epithelial target cells respond to viral infection with specific alterations in gene expression, including production of chemoattractant cytokines, adhesion molecules, elements that are related to the apoptosis response, and others that remain incompletely understood. Here we review our current understanding of these mucosal responses and discuss several genomic approaches, including differential display reverse transcription-polymerase chain reaction (PCR) and gene array strategies, that will permit us to unravel the nature of these responses in a more complete and systematic manner."
zjufx4fo,Sequence requirements for RNA strand transfer during nidovirus discontinuous subgenomic RNA synthesis,"Nidovirus subgenomic mRNAs contain a leader sequence derived from the 5′ end of the genome fused to different sequences (‘bodies’) derived from the 3′ end. Their generation involves a unique mechanism of discontinuous subgenomic RNA synthesis that resembles copy-choice RNA recombination. During this process, the nascent RNA strand is transferred from one site in the template to another, during either plus or minus strand synthesis, to yield subgenomic RNA molecules. Central to this process are transcription-regulating sequences (TRSs), which are present at both template sites and ensure the fidelity of strand transfer. Here we present results of a comprehensive co-variation mutagenesis study of equine arteritis virus TRSs, demonstrating that discontinuous RNA synthesis depends not only on base pairing between sense leader TRS and antisense body TRS, but also on the primary sequence of the body TRS. While the leader TRS merely plays a targeting role for strand transfer, the body TRS fulfils multiple functions. The sequences of mRNA leader–body junctions of TRS mutants strongly suggested that the discontinuous step occurs during minus strand synthesis."
5yhe786e,Debate: Transfusing to normal haemoglobin levels will not improve outcome,"Recent evidence suggests that critically ill patients are able to tolerate lower levels of haemoglobin than was previously believed. It is our goal to show that transfusing to a level of 100 g/l does not improve mortality and other clinically important outcomes in a critical care setting. Although many questions remain, many laboratory and clinical studies, including a recent randomized controlled trial (RCT), have established that transfusing to normal haemoglobin concentrations does not improve organ failure and mortality in the critically ill patient. In addition, a restrictive transfusion strategy will reduce exposure to allogeneic transfusions, result in more efficient use of red blood cells (RBCs), save blood overall, and decrease health care costs."
8zchiykl,"The 21st International Symposium on Intensive Care and Emergency Medicine, Brussels, Belgium, 20-23 March 2001","The 21st International Symposium on Intensive Care and Emergency Medicine was dominated by the results of recent clinical trials in sepsis and acute respiratory distress syndrome (ARDS). The promise of extracorporeal liver replacement therapy and noninvasive ventilation were other areas of interest. Ethical issues also received attention. Overall, the 'state of the art' lectures, pro/con debates, seminars and tutorials were of a high standard. The meeting was marked by a sense of renewed enthusiasm that positive progress is occurring in intensive care medicine."
8qnrcgnk,Heme oxygenase-1 and carbon monoxide in pulmonary medicine,"Heme oxygenase-1 (HO-1), an inducible stress protein, confers cytoprotection against oxidative stress in vitro and in vivo. In addition to its physiological role in heme degradation, HO-1 may influence a number of cellular processes, including growth, inflammation, and apoptosis. By virtue of anti-inflammatory effects, HO-1 limits tissue damage in response to proinflammatory stimuli and prevents allograft rejection after transplantation. The transcriptional upregulation of HO-1 responds to many agents, such as hypoxia, bacterial lipopolysaccharide, and reactive oxygen/nitrogen species. HO-1 and its constitutively expressed isozyme, heme oxygenase-2, catalyze the rate-limiting step in the conversion of heme to its metabolites, bilirubin IXα, ferrous iron, and carbon monoxide (CO). The mechanisms by which HO-1 provides protection most likely involve its enzymatic reaction products. Remarkably, administration of CO at low concentrations can substitute for HO-1 with respect to anti-inflammatory and anti-apoptotic effects, suggesting a role for CO as a key mediator of HO-1 function. Chronic, low-level, exogenous exposure to CO from cigarette smoking contributes to the importance of CO in pulmonary medicine. The implications of the HO-1/CO system in pulmonary diseases will be discussed in this review, with an emphasis on inflammatory states."